{
  "schema_version": 1,
  "run_id": "20260917-e2e",
  "created_at": "2026-09-17T18:21:42.831147+00:00",
  "tasks": [
    {
      "name": "implement-slugify",
      "worker": "worker:implementer",
      "brief": ".root-architect/briefs/20260917-e2e/implement-slugify.json",
      "state": "pending"
    },
    {
      "name": "spec-check-slugify",
      "worker": "worker:spec-validator",
      "brief": ".root-architect/briefs/20260917-e2e/spec-check-slugify.json",
      "state": "pending"
    },
    {
      "name": "quality-check-slugify",
      "worker": "worker:quality-validator",
      "brief": ".root-architect/briefs/20260917-e2e/quality-check-slugify.json",
      "state": "pending"
    }
  ]
}
